ID_RICHIESTA,RICHIESTA ANNO PROT,RICHIESTA DATA,PROCEDIMENTO,ESITO PRATICA,CHIUSURA PRATICA DATA,CODICE VIA,CIVICO,ESPONENTE CIVICO,LOCALIZZAZIONI LISTA,DESCRIZIONE_RICHIESTA,LOCALIZZAZIONE_RICHIESTA,ANNO,NOMI_FILE,indirizzo_pulito,lat,lon
113586,2010,2010-05-06,permesso di costruire,Rilasciata con prescrizioni,2010-12-17,20950.0,47.0,,VIA DUE MADONNE N.  47,"demolizione e ricostruzione fuori sagoma di edificio ad uso 1a, 3b, 4d con incrmento una-tantum ai sensi dell'art.56 del RUE",VIA DUE MADONNE N.  47,2010.0,PDC dicembre 2010.xls,"Via Due Madonne 47, Bologna",44.487346,11.3973114
145768,2010,2010-06-09,permesso di costruire,Rilasciata,2010-11-03,55950.0,71.0,,VIA STALINGRADO N.  71,"Variante in c.o alla p.g. 46199/2007  essenziale per cambio d'uso con opere da  commercio al dettaglio ad ufficio 3b con variazione degli standards ,modifiche prospettiche dei due edifici variazioni sull'area esterna limitrofa agli edifici oggetto di permesso di costruire, spostamenti delle strutture adibite a lavaggio auto in batteria",VIA STALINGRADO N.  71,2010.0,PDC novembre 2010.xls,"Via Stalingrado 71, Bologna",44.5189125,11.3625498
146434,2010,2010-06-09,permesso di costruire,Rilasciata con prescrizioni,2010-11-25,700.0,6.0,,VIA DEGLI AGRESTI N.  6,permesso a costruire ai sensi dell'art. 106 del RUE con procedimento unico ai sensi DPR  447/98 per la realizzazione di cabina enel di trasformazione secondaria sita al piano interrato a servizio dell'edificio ad uso direzionale sito in via degli Agresti n° 4 - 6  - rif. pratica sportello imprese n° 143800 del 08/06/2010,VIA DEGLI AGRESTI N.  6,2010.0,PDC novembre 2010.xls,"Via Degli Agresti 6, Bologna",44.49343,11.3395804
156385,2010,2010-06-18,permesso di costruire,Rilasciata,2010-09-30,14300.0,,,VIA CASTELDEBOLE  ( Civico da definire ) nei pressi del civico 8,Permesso di costruire per variante in C.O. minore alla P.G. n. 119145/07 per modifica di volume entro il 10% della nuova serra,VIA CASTELDEBOLE  N. 8,2010.0,PDC settembre 2010.xls,"Via Casteldebole 8, Bologna",44.4903038,11.2730698
180556,2010,2010-07-12,permesso di costruire,Rilasciata,2010-09-02,48570.0,1.0,,VIA GIULIO CESARE PUPILLI N.  1,nuova costruzione di palazzina destinata ad ambulatori nell'ambito dell'Istituto Ortopedico Rizzoli (vedere scheda RUE),VIA GIULIO CESARE PUPILLI N.  1,2010.0,PDC settembre 2010.xls,"Via Giulio Cesare Pupilli 1, Bologna",44.4815171,11.3416141
189349,2010,2010-07-23,permesso di costruire,Rilasciata,2011-04-08,57750.0,2.0,1,VIA BENVENUTO TISI N.  2 / 1,a vco essenziale alla DIA pg 304488/2008 per NC di edificio ad uso residenziale previo demolizione del volume esistente,VIA BENVENUTO TISI N.  2 / 1,2010.0,PDC aprile 2011.xls,"Via Benvenuto Tisi 2 / 1, Bologna",44.5027018,11.3017121
197851,2010,2010-08-04,permesso di costruire,Rilasciata,2011-02-16,30280.0,1.0,,VIA DELL'INTAGLIATORE N.  1,"Richiesta di PdC per ampliamento di fabbricato ad uso laboratorio con sfruttamento della residua capacità edificatoria oltre alla realizzazione di un piano interrato, in variante minore al PdiC pg. 173709/2007",VIA DELL'INTAGLIATORE N.  1,2010.0,PDC febbraio 2011.xls,"Via Dell'Intagliatore 1, Bologna",44.5038606,11.4114765
199762,2010,2010-08-06,permesso di costruire,Rilasciata con prescrizioni,2011-01-24,48750.0,8.0,,VIA QUARTO DI SOPRA N.  8,"ricostruzione di edifici storici (ex 2a e 2b), con frazionamento e cambio d'uso - rif. scheda 35 del P.O.C.",VIA QUARTO DI SOPRA N.  8,2010.0,PDC gennaio 2011.xls,"Via Quarto Di Sopra 8, Bologna",44.5223956,11.4225279
300292,2010,2010-12-15,permesso di costruire,Rilasciata con prescrizioni,2011-06-30,36800.0,183.0,,VIA GIUSEPPE MASSARENTI N.  183,"demolizione di edificio esistente e realizzazione di nuovo fabbricato a destinazione residenziale a piano interrato, terra, primo, secondo - con applicazione del comma 3 dell'art. 56 del RUE",VIA GIUSEPPE MASSARENTI N.  183,2010.0,PDC  giugno 2011.xls,"Via Giuseppe Massarenti 183, Bologna",44.4929143,11.3834773
28378,2011,2011-02-09,permesso di costruire,Rilasciata con prescrizioni,2012-06-12,54580.0,29.0,,VIA WILLIAM SHAKESPEARE N.  29,Permesso di Costruire (per ambiti) per nuova costruzione di  centrale di teleriscaldamento all'interno del depuratore citta' di Bologna,VIA WILLIAM SHAKESPEARE N.  29,2011.0,PDC giugno 2012.xls,"Via William Shakespeare 29, Bologna",44.5519186,11.3642423
69819,2011,2011-03-31,permesso di costruire,Rilasciata,2012-05-10,54580.0,29.0,,VIA WILLIAM SHAKESPEARE N.  29,realizzazione di impianto di produzione ossigeno all'interno dell'area destinata al depuratore presentata con procedimento unico protocollo SUAP p.g. n.57823 del 16/03/2011,VIA WILLIAM SHAKESPEARE N.  29,2011.0,PDC maggio 2012.xls,"Via William Shakespeare 29, Bologna",44.5519186,11.3642423
108072,2011,2011-05-12,permesso di costruire,Rilasciata con prescrizioni,2011-10-06,750.0,121.0,4,VIA AGUCCHI N.  121 / 4,Permesso di Costruire per ampliamento di officina meccanica ,VIA AGUCCHI N.  121 / 4,2011.0,PDC ottobre 2011.xls,"Via Agucchi 121 / 4, Bologna",44.5117139,11.2995347
131064,2011,2011-06-06,permesso di costruire,Rilasciata con prescrizioni,2011-12-22,25420.0,1.0,,VIA PIETRO GAMBERINI N.  1,Nuova costruzione di edificio residenziale previa demolizione di edificio esistente con utilizzo dell'incentivo volumetrico del 20% previsto all'art. 56 del RUE.,VIA PIETRO GAMBERINI N.  1,2011.0,PDC dicembre 2011.xls,"Via Pietro Gamberini 1, Bologna",44.5028191,11.2932269
154041,2011,2011-06-27,permesso di costruire,Rilasciata,2011-10-17,43750.0,4.0,2,VIA DELLA PALMA N.  4 / 2,"Realizzazione di un vano interrato, recupero di sa ad autorimessa in Su e recupero di un vano interrato in autorimnessa con realizzazione di rampa per l'accesso , modifiche prospettiche per realizzazione di scala esterna e due pensiline, rifacimento del manto di copertura in coppi, realizzazione di lucernario, oltre a modifiche alla sistemazione dell'area cortiliva, richiesta di applicazione art. 100 comma 6 del RUE - rif AP n° 219869/2010",VIA DELLA PALMA N.  4 / 2,2011.0,PDC ottobre 2011.xls,"Via Della Palma 4 / 2, Bologna",44.4573445,11.3559372
175954,2011,2011-07-20,permesso di costruire,Rilasciata con prescrizioni,2012-04-23,45200.0,3.0,,VIA DEL PERUGINO N.  3,"opere di sostituzione ai sensi dell'art. 62 comma 3 del RUE finalizzate alla realizzazione di edificio residenziale a piano interrato, terra, primo, secondo, terzo e quarto",VIA DEL PERUGINO N.  3,2011.0,PDC aprile 2012.xls,"Via Del Perugino 3, Bologna",44.479777,11.3780064
186483,2011,2011-08-03,permesso di costruire,Rilasciata,2011-12-01,19340.0,2.0,,VIA DEL DECORATORE N.  2,"realizzazione di cabina elettrica annessa ad edificio uso 2b, in variante essenziale alla DIA 276671/2010",VIA DEL DECORATORE N.  2,2011.0,PDC dicembre 2011.xls,"Via Del Decoratore 2, Bologna",44.4999525,11.3985741
197078,2011,2011-08-24,permesso di costruire,Diniegata,2012-09-06,15200.0,,,VIA ANTONIO CAVALIERI DUCATI  ( Civico da definire ),sostituzione di edicola con ampliamento della stessa  ,VIA GALEAZZA N.  2 / 1a,2012.0,PDC dicembre 2012.xls,"Via Galeazza 2 / 1A, Bologna",44.5045701,11.2754867
245176,2011,2011-10-19,permesso di costruire,Rilasciata con prescrizioni,2011-11-14,55550.0,2.0,,VIA ARMANDO SPADINI N.  2,Demolizione di edifici documentali ad uso produttiva (2a) con NC di n.2 fabbricati ad uso residenziale con contestuale ampliamento dei cui all'art.56.3 una-tantum del 20%.  ,VIA ARMANDO SPADINI N.  2,2011.0,PDC novembre 2011.xls,"Via Armando Spadini 2, Bologna",44.5042834,11.2944581
289038,2011,2011-12-15,permesso di costruire,Rilasciata con prescrizioni,2012-06-04,24900.0,30.0,,VIA GALEAZZA N.  30,demolizione con fedele ricostruzione e ampliamento del 20% di cui all'art. 56 per requisiti d'eccellenza del capannone per adeguarlo a 28 abitazioni ,VIA GALEAZZA N.  30,2011.0,PDC giugno 2012.xls,"Via Galeazza 30, Bologna",44.5034665,11.2752614
294770,2011,2011-12-22,permesso di costruire,Rilasciata,2012-04-12,10250.0,17.0,4,VIA EDOARDO BRIZIO N.  17 / 4,"ristrutturazione globale, cambio d'uso e nuova costruzione con riutilizzo dei volumi esistenti",VIA EDOARDO BRIZIO N.  17 / 4,2011.0,PDC aprile 2012.xls,"Via Edoardo Brizio 17 / 4, Bologna",44.4935616,11.3200916
23413,2012,2012-02-01,permesso di costruire,Rilasciata,2012-07-26,58600.0,34.0,,VIA TOSCANA N.  34,"ampliamento di ai sensi dell'art. 45 del RUE della casa di cura ""madre fortunata toniolo""",VIA TOSCANA N.  34,2012.0,PDC luglio 2012.xls,"Via Toscana 34, Bologna",44.4678483,11.3711404
64589,2012,2012-03-15,permesso di costruire,Rilasciata,2012-08-02,31150.0,5.0,,VIA SILVESTRO LEGA N.  5,Demolizione con ricostruzione di edificio e ampliamento con utilizzo dell'incentivo volumetrico del 10% previsto all'art. 56 del RUE,VIA SILVESTRO LEGA N.  5,2012.0,PDC agosto 2012.xls,"Via Silvestro Lega 5, Bologna",44.5070941,11.2962059
98813,2012,2012-04-26,permesso di costruire,Rilasciata con prescrizioni,2012-10-25,25420.0,1.0,,VIA PIETRO GAMBERINI N.  1,a v.c.o. essenziale al PdC pg 131064/2011 per soprelevazione e ampliamento di sagoma in edificio ad uso residenziale,VIA PIETRO GAMBERINI N.  1,2012.0,PDC ottobre 2012.xls,"Via Pietro Gamberini 1, Bologna",44.5028191,11.2932269
124402,2012,2012-05-23,permesso di costruire,Rilasciata con prescrizioni,2012-09-20,20700.0,9.0,,VIA DOSSO DOSSI N.  9,Variante in c.o. minore PG 155258/2008 per modifica della sagoma realizzate con il PRG,VIA DOSSO DOSSI N.  9,2012.0,PDC settembre 2012.xls,"Via Dosso Dossi 9, Bologna",44.5016297,11.2997125
128404,2012,2012-05-28,permesso di costruire,Rilasciata con prescrizioni,2013-01-21,30150.0,7.0,,VIA DELL'INDIPENDENZA N.  7,opere di manutenzione straordinaria e cambi d'uso in intero edificio storico-documentale ,VIA DELL'INDIPENDENZA N.  7,2012.0,PDC gennaio 2013.xls,"Via Dell'Indipendenza 7, Bologna",44.4954039,11.3429346
131204,2012,2012-05-31,permesso di costruire,Rilasciata con prescrizioni,2012-12-17,54830.0,10.0,,VIA IGNAZIO SILONE N.  10, per demolizione di edificio ad uso promiscuo magazzino/uffici e nuova costruzione di edificio residenzilae con utilizzo dell'incremento una tantum di eccelenza del 20% previsto dall'art 56 comma 2 del RUE,VIA IGNAZIO SILONE N.  10,2012.0,PDC dicembre 2012.xls,"Via Ignazio Silone 10, Bologna",44.5424241,11.3631198
165009,2012,2012-07-05,permesso di costruire,Rilasciata,2013-06-10,55700.0,30.0,,VIA SPERANZA N.  30,Ampliamento di attrezzatura socio assistenziale privata con utilizzo dell'incremento volumetrico previsto all'art. 45 del RUE.,VIA SPERANZA N.  30,2012.0,PDC giugno 2013.xls,"Via Speranza 30, Bologna",44.506096,11.2967371
170006,2012,2012-07-11,permesso di costruire,Rilasciata con prescrizioni,2012-12-06,1850.0,9.0,2,VIA ALTURA N.  9 / 2,"demolizione di edificio esistente e realizzazione di nuovo edificio ad uso pubblico esercizio (ristorante), con applicazione dell'ampliamento del 20% previsto dall'art. 56 comma 3 del RUE ",VIA ALTURA N.  9 / 2,2012.0,PDC dicembre 2012.xls,"Via Altura 9 / 2, Bologna",44.4653795,11.3967613
171175,2012,2012-07-12,permesso di costruire,Rilasciata,2012-12-20,37300.0,174.0,,VIA MAZZINI N.  174,"variante in corso d'opera al P.di C.P.G. 56721/2010 per eliminazione del secondo piano interrato, modifiche di sagoma e superficie utile inferiore 10% delle singole unità immobiliari e diverse  sistemazioni esterne in edifici mono e bi-familiari a piano terra, primo e secondo, realizzazione di superficie interrata ad uso parcheggio privato (uso abitativo)",VIA MAZZINI N.  174,2012.0,PDC dicembre 2012.xls,"Via Mazzini 174, Bologna",44.4001693,11.593601
179718,2012,2012-07-24,permesso di costruire,Rilasciata,2012-11-28,9340.0,16.0,3,VIA GIANGUIDO BORGHESE N.  16 / 3,a variante in C.O.minore alla P.G. n. 284421/09 per modifica di sagoma e partiture interne dell'intero edificio,VIA GIANGUIDO BORGHESE N.  16 / 3,2012.0,PDC novembre 2012.xls,"Via Gianguido Borghese 16 / 3, Bologna",44.4958007,11.2956879
185993,2012,2012-08-01,permesso di costruire,Rilasciata,2012-10-09,21200.0,4.0,,VIA EGNAZIA N.  4,Demolizione di autorimesse esistenti e nuova costruzione con riordino delle volumetrie di n. 7 autorimesse e abbassamento del piano di campagna sottostante i manufatti in NC.,VIA EGNAZIA N.  4,2012.0,PDC ottobre 2012.xls,"Via Egnazia 4, Bologna",44.5065087,11.2974111
186984,2012,2012-08-02,permesso di costruire,Rilasciata,2012-12-18,20800.0,11.0,,VIA DELLA DOZZA N.  11,"Nuova costruzione di edificio ad uso deposito 2b previo demolizione di edifici destinati  a depositi 2b e laboratorio 2a (Vt= Vte), cambio di destinazione d'uso con opere di M.S da 2a a 1a e declassamento di SU in SA destinado tale superficie ad autorimessa ",VIA DELLA DOZZA N.  11,2012.0,PDC dicembre 2012.xls,"Via Della Dozza 11, Bologna",44.5308668,11.3619093
246869,2012,2012-10-18,permesso di costruire,Rilasciata con prescrizioni,2014-01-13,44680.0,16.0,,VIA VITTORIO PEGLION N.  16,Permesso di Costruire  per demolizione di magazzino agricolo e sua ricostruzione con sfruttamento dell'incremento del 20% di cui all'art. 56 con realizzazione di edficio tri-familiare.,VIA VITTORIO PEGLION N.  16,2012.0,PDC gennaio 2014.xls,"Via Vittorio Peglion 16, Bologna",44.5476523,11.3658969
268721,2012,2012-11-15,permesso di costruire,Rilasciata con prescrizioni,2013-06-19,7950.0,1.0,,VIA NINO BERTOCCHI N.  1,Variante in c.o. minore alla PG 37959/2012 per nuova costruzione in ampliamento a u.i. ad uso ristorante (5c) previo recupero di volumetrie condonate.,VIA NINO BERTOCCHI N.  1,2012.0,PDC giugno 2013.xls,"Via Nino Bertocchi 1, Bologna",44.4998268,11.2955799
280039,2012,2012-11-29,permesso di costruire,Rilasciata con prescrizioni,2014-06-20,21400.0,358.0,,VIA EMILIA PONENTE N.  358,Permesso di Costruire per la ristrutturazione dell'intero edificio unifamiliare (demolizione con ricostruzione entro sagoma) e nuova costruzione per ampliamento fuori sagoma con ricorso all'incremento volumetrico del 20% art 56 RUE,VIA EMILIA PONENTE N.  358,2012.0,PDC giugno 2014.xls,"Via Emilia Ponente 358, Bologna",44.5134684,11.2851479
1147,2013,2013-01-03,permesso di costruire,Rilasciata con prescrizioni,2013-05-07,18300.0,16.0,,VIA DONATO CRETI N.  16,"Variante in c.o. essenziale alla p.g. 172626/20111 per demolizione e ricostruzione con ampliamento  di ex fabbricato indutriale (2a) in complesso ad uso residenziale (1a), negozi (4d) e uffici (3b).",VIA DONATO CRETI N.  16,2013.0,PDC maggio 2013.xls,"Via Donato Creti 16, Bologna",44.5104669,11.3519319
34106,2013,2013-02-13,permesso di costruire,Rilasciata,2013-05-22,36800.0,59.0,,VIA GIUSEPPE MASSARENTI N.  59,"spostamento dell'area di sedime di edificio ad uso 7a, in  variante minore al Permesso di Costruire PG 191260/2011",VIA GIUSEPPE MASSARENTI N.  59,2013.0,PDC maggio 2013.xls,"Via Giuseppe Massarenti 59, Bologna",44.4925333,11.3691694
35324,2013,2013-02-14,permesso di costruire,Rilasciata con prescrizioni,2013-09-10,48000.0,5.0,,VIA GAETANO PREVIATI N.  5,nuova costruzione con ampliamento ai sensi dell'art.56 del RUE previa demolizione dell'esistente (uso abitativo),VIA GAETANO PREVIATI N.  5,2013.0,PDC settembre 2013.xls,"Via Gaetano Previati 5, Bologna",44.4814278,11.3747266
42451,2013,2013-02-21,permesso di costruire,Rilasciata con prescrizioni,2013-05-30,18000.0,69.0,2,VIA ANDREA COSTA N.  69 / 2,Richiesta di permesso di costruire in V.C.O. essenziale alla P.G. 267866/2010 per modesta modifica di sagoma e cambio d'uso verso uffici (3b) e negozio (4d) - intero edificio ex cinema- ,VIA ANDREA COSTA N.  69 / 2,2013.0,PDC maggio 2013.xls,"Via Andrea Costa 69 / 2, Bologna",44.495379,11.3231358
96224,2013,2013-04-24,permesso di costruire,Rilasciata con prescrizioni,2013-10-22,22320.0,18.0,A,VIALE FELSINA N.  18 / A,variante minore in corso d'opera al Permesso di Costruire pg 212114/2010 per modesto aumento di volume e cambio d'uso verso la residenza di alcune unità,VIALE FELSINA N.  18 / A,2013.0,PDC ottobre 2013.xls,"Viale Felsina 18 / A, Bologna",44.4866189,11.3772759
96339,2013,2013-04-24,permesso di costruire,Rilasciata con prescrizioni,2013-10-09,17950.0,203.0,,VIA DI CORTICELLA N.  203,Variante in c.o. essenziale per demolizione e ricostruzione con ampliamento utilizzando l'incremento dell'art. 56 del 20% per realizzazione di edificio ad uso uffici e produttivo.,VIA DI CORTICELLA N.  203,2013.0,PDC ottobre 2013.xls,"Via Di Corticella 203, Bologna",44.5345235,11.3549224
174745,2013,2013-07-10,permesso di costruire,Rilasciata,2014-01-28,11050.0,40.0,,VIA CADRIANO N.  40,restauro e ristrutturazione della ex pieve S. Maria si Calamosco  ,VIA CADRIANO N.  40,2013.0,PDC gennaio 2014.xls,"Via Cadriano 40, Bologna",44.5336373,11.3886073
199551,2013,2013-08-07,permesso di costruire,Rilasciata con prescrizioni,2013-10-15,23330.0,4.0,,VIA DEL FONDITORE N.  4,realizzazione di cabina elettrica annessa ad unità immobiliare ad uso produttivo,VIA DEL FONDITORE N.  4,2013.0,PDC ottobre 2013.xls,"Via Del Fonditore 4, Bologna",44.5042068,11.4057939
13952,2014,2014-01-17,permesso di costruire,Rilasciata,2014-02-18,58300.0,4.0,,VIA DELLA TORRE N.  4,"realizzazione di un piano interrato fuori dall'area di sedime dell'edificio unifamiliare per realizzazione di autorimessa e pertinenze, modifica della sistemazione esterna dell'area cortiliva con posa di pavimentazioni, abbattimenti e rimpianti di alberature, installazione di ringhiere, parapetti, installazione di due comignoli ed eliminazione di uno, realizzazione di due scale esterne - RIF. autorizzazione paesaggistica n° 191073/2013",VIA DELLA TORRE N.  4,2014.0,PDC febbraio 2014.xls,"Via Della Torre 4, Bologna",44.4443255,11.3304941
60954,2014,2014-02-27,permesso di costruire,Rilasciata con prescrizioni,2014-05-15,30050.0,,,VIA JACOPO DI PAOLO,Permesso di Costruire per nuova costruzione di capannone uso commercio all'ingrosso su lotto libero al 18/07/1986 in applicazioneall'art 10  del P.O.C,VIA JACOPO DI PAOLO,2014.0,PDC maggio 2014.xls,"Via Jacopo Di Paolo, Bologna",44.5199568,11.3540241
70077,2014,2014-03-06,permesso di costruire,Rilasciata con prescrizioni,2014-05-07,7400.0,8.0,a,VIA ELIO BERNARDI N.  8 / a,Permesso di Costruire in Variante in c.o alla p.g. 250982/2012 per ampliamento di volumetria al piano terzo dell'edificio abitativo,VIA ELIO BERNARDI N.  8 / a,2014.0,PDC maggio 2014.xls,"Via Elio Bernardi 8 / A, Bologna",44.5093791,11.3005241
70201,2014,2014-03-06,permesso di costruire,Rilasciata con prescrizioni,2014-12-09,15820.0,,,"VIA GIUSEPPE CERI  ( Civico da definire ) a fronte dei civ.16,18,20,22,24","demolizione e ricostruzione con ampliamento art.56 RUE e cd da magazzino ad abitazione (di fronte ai civ.16,18,20,22,24)",VIA GIUSEPPE CERI N. 20,2014.0,PDC dicembre 2014.xls,"Via Giuseppe Ceri 20, Bologna",44.5238007,11.4192857
83939,2014,2014-03-20,permesso di costruire,Rilasciata,2014-07-08,43980.0,18.0,,VIA GIOVANNI PAPINI N.  18,creazione di volume per motivi estetici nel rivestire l'edificio esistente,VIA GIOVANNI PAPINI N.  18,2014.0,PDC luglio 2014.xls,"Via Giovanni Papini 18, Bologna",44.5337,11.3530719
100631,2014,2014-04-07,permesso di costruire,Rilasciata,2014-08-01,2900.0,59.0,2,VIA DELL'ARCOVEGGIO N.  59 / 2,variante in C.O. alla SCIA p.g. n.114090/11 per la costruzione di tettoia di accesso e bussola d'ingresso al capannone,VIA DELL'ARCOVEGGIO N.  59 / 2,2014.0,PDC agosto 2014.xls,"Via Dell'Arcoveggio 59 / 2, Bologna",44.5350994,11.3491014
115536,2014,2014-04-18,permesso di costruire,Decaduta,2014-10-06,11900.0,,,VIA PIER FORTUNATO CALVI  ( Civico da definire ),Nuova Costruzione di un edificio con destinazione residenziale in base all'art. 10 del POC,VIA PIER FORTUNATO CALVI  ( Civico da definire ),2014.0,PDC ottobre 2014.xls,"Via Pier Fortunato Calvi ( ), Bologna",44.5194091,11.2931658
130559,2014,2014-05-07,permesso di costruire,Rilasciata con prescrizioni,2014-12-18,18000.0,187.0,,VIA ANDREA COSTA N.  187,"demolizione di complesso idustriale (2a) e ricostruzione, con ampliamento del 10%, di edificio ad uso residenziale ",VIA ANDREA COSTA N.  187,2014.0,PDC dicembre 2014.xls,"Via Andrea Costa 187, Bologna",44.4934125,11.3048949
135108,2014,2014-05-09,permesso di costruire,Rilasciata con prescrizioni,2015-02-11,14300.0,,,VIA CASTELDEBOLE,Richiesta parere ai sensi del comma 5 art.5 L.R.15/2013in merito alla richiesta  di P. di C. in Variante essenziale al PG 293296/2008 -procedimento SUAP PG 123133/2014 del 29/04/2014- Porrettana Gomme,VIA CASTELDEBOLE,2014.0,PDC gennaio 2015.xls,"Via Casteldebole, Bologna",44.5022666,11.2711662
162922,2014,2014-06-03,permesso di costruire,Rilasciata,2014-10-30,17680.0,1.0,,VIA DEL CONCIATORE N.  1,Nuova costruzione di due tettoie aperte su 3 lati e di un deposito senza permanenza di persone in Via del Conciatore 1 intervento in ambito da riqualificare specializzato n.128 Roveri quale area soggetta a specifica normativa ove si interviene ai sensi del previgente sistema di pianificazione(PRG) ai sensi dell’articolo 11 del POC n.38 dell’appendice 2 del POC.,VIA DEL CONCIATORE N.  1,2014.0,PDC ottobre 2014.xls,"Via Del Conciatore 1, Bologna",44.4992297,11.4003455
1425,2008,2008-01-03,permesso di costruire a parziale sanatoria,Decaduta,2009-04-30,63100.0,41.0,,VIA FRANCESCO ZANARDI N.  41,"demolizione e ricostruzione di rampa carrabile esterna con modifiche interne ed esterne, demolizione di porzione di pensilina e installazione di impianti tecnologici sul coperto in unità ad uso commercio all'auto in vco al PG 245519/05 (p.seminterrato, t, 1°) pratica presentata a Sportello Attività produttive in data 12/12/07 PG 291274/07",VIA FRANCESCO ZANARDI N.  41,2008.0,PDC dicembre 2008.xls,"Via Francesco Zanardi 41, Bologna",44.5121919,11.3279272
36447,2008,2008-02-12,permesso di costruire a parziale sanatoria,Rilasciata,2008-12-15,39800.0,14.0,,VIA BRUNO MONTERUMICI N.  14 -P.T. E SEM/1,Variante in corso d'opera essenziale a parziale sanatoria alle DIA PG 50137/05 e PG 93040/05,VIA BRUNO MONTERUMICI N. 14 ,2008.0,PDC dicembre 2008.xls,"Via Bruno Monterumici 14, Bologna",44.5030766,11.3104328
82817,2008,2008-04-10,permesso di costruire a parziale sanatoria,Rilasciata,2008-09-23,32130.0,4.0,,VIA LIDICE N.  4,vcd'o  per la realizzazione di un volume sul lastrico e la chiusura di una loggia VIII° in unità residenziale.,VIA LIDICE N.  4,2008.0,PDC settembre 2008.xls,"Via Lidice 4, Bologna",44.4733275,11.3986023
190443,2008,2008-07-25,permesso di costruire a parziale sanatoria,Rilasciata,2008-12-18,21750.0,72.0,,VIA DEL FAGGIOLO N.  72 PIANO 1°,Variante in Corso d'Opera alla PG 193717/07 per nuova costruzione in ampliamento con utilizzo una tantum e parziale sanantoria per la demolizione del magazzino al piano terra,VIA DEL FAGGIOLO N.  72 PIANO 1°,2008.0,PDC dicembre 2008.xls,"Via Del Faggiolo 72 °, Bologna",44.5113048,11.2839912
209274,2008,2008-09-03,permesso di costruire a parziale sanatoria,Rilasciata,2008-12-18,30140.0,7.0,,VIA DELL'INCISORE N.  7,Nc per ampliamento della palazzina uffici,VIA DELL'INCISORE N.  7,2008.0,PDC dicembre 2008.xls,"Via Dell'Incisore 7, Bologna",44.5029524,11.4098901
218946,2008,2008-09-15,permesso di costruire a parziale sanatoria,Rilasciata,2009-03-10,12250.0,10.0,,VIA DEL CAMPEGGIO N.  10,interventi di NC di tettoia e realizzazione soppalco entro sagoma a sanatoria e ampliamento del magazzino/deposito agricolo esistente in progetto (U16),VIA DEL CAMPEGGIO N.  10,2008.0,PDC marzo 2009.xls,"Via Del Campeggio 10, Bologna",44.5421018,11.2858915
1595,2009,2009-01-07,permesso di costruire a parziale sanatoria,Rilasciata,2009-04-21,4850.0,19.0,,VIA DELLA BARCA N.  19,ampliamento di u.i. ad uso residenziale mediante utilizzo di una tantum,VIA DELLA BARCA N.  19,2009.0,PDC aprile 2009.xls,"Via Della Barca 19, Bologna",44.4939261,11.2977983
7738,2009,2009-01-15,permesso di costruire a parziale sanatoria,Rilasciata con prescrizioni,2009-09-09,18650.0,24.0,,VIA CROCIALI N.  24,ampliamento a piano terra con utilizzo di una tantum e realizzazione di pensilina in unità immobiliare ad uso abitativo,VIA CROCIALI N.  24,2009.0,PDC settembre 2009.xls,"Via Crociali 24, Bologna",44.4913285,11.3730385
16312,2009,2009-01-26,permesso di costruire a parziale sanatoria,Rilasciata,2009-02-26,46750.0,2.0,d,VIA PODGORA N.  2 / d,vco al PdC pg 173801/2006 e dia pg 138772/2006 per aumento di Volume senza incremento di Su e Sa in edificio ad uso residenziale,VIA PODGORA N.  2 / d,2009.0,PDC febbraio 2009.xls,"Via Podgora 2 / D, Bologna",44.5010998,11.3207152
119382,2009,2009-05-15,permesso di costruire a parziale sanatoria,Rilasciata,2010-02-01,59980.0,6.0,,VIA GIUSEPPE VACCARO N.  6,"Sanatoria per realizzazione di portico e n. 4 manufatti ad uso cuccia per cani, ripostiglio, box, legnaia e pergolato e realizzazione di pensilina trasformazione di parte della autorimessa in bagno",VIA GIUSEPPE VACCARO N.  6,2009.0,PDC febbraio 2010.xls,"Via Giuseppe Vaccaro 6, Bologna",44.5035468,11.2737835
215314,2009,2009-09-02,permesso di costruire a parziale sanatoria,Rilasciata,2010-08-31,2100.0,36.0,,VIA ISABELLA ANDREINI N.  36,ampliamento di complesso parrocchiale,VIA ISABELLA ANDREINI N.  36,2009.0,PDC agosto 2010.xls,"Via Isabella Andreini 36, Bologna",44.499824,11.3736208
221688,2009,2009-09-09,permesso di costruire a parziale sanatoria,Rilasciata con prescrizioni,2010-04-08,23050.0,42.0,2,VIA ARISTOTILE FIORAVANTI N.  42 / 2,Richiesta di PDC a parziale sanatoria per opere di ampliamento e trasformazione di Sa in Su (parte a sanatoria) ed opere interne ed esterne di manutenzione straordinaria in progetto.,VIA ARISTOTILE FIORAVANTI N.  42 / 2,2009.0,PDC aprile 2010.xls,"Via Aristotile Fioravanti 42 / 2, Bologna",44.5138698,11.3412938
